{
  "kind": "program",
  "provenance": "first-party",
  "runsOn": {
    "location": "local",
    "platform": "macOS test host app compiled from AxoMac with fixture-only launch modes"
  },
  "summary": "The dedicated test-host executable runs either a file-driven UI-test fixture against an isolated daemon or an app-to-daemon self-test; these automation and exit paths are absent from the shipped app.",
  "anchors": [
    "apple/AxoMac/Sources/AxoMacTestHost/AxoAppEnvironment+TestHost.swift",
    "apple/AxoMac/Sources/AxoMacTestHost/AxoAppSelfTest.swift",
    "apple/AxoMac/Sources/AxoMacTestHost/TerminalUITestAutomation.swift",
    "apple/AxoMac/BUILD.bazel",
    "apple/AxoMac/run_visual_ui_test.sh"
  ],
  "sources": {
    "apple/AxoMac/BUILD.bazel": "46168116f18b875966102acd7b3693e5c7c3ff5d",
    "apple/AxoMac/Sources/AxoMacTestHost/AxoAppEnvironment+TestHost.swift": "8eb01e78114b1501961ec66acdb6c626cb33aa8a",
    "apple/AxoMac/Sources/AxoMacTestHost/AxoAppSelfTest.swift": "c6d9667911a52add52608287e92fd108dfe355cb",
    "apple/AxoMac/Sources/AxoMacTestHost/TerminalUITestAutomation.swift": "3df23692797c22b6857d0d8f6a4a2038faf89951",
    "apple/AxoMac/run_visual_ui_test.sh": "190fc053dd9db74f0a4fd12618564d0af6573b41"
  }
}
