{
  "kind": "program",
  "provenance": "first-party",
  "runsOn": {
    "location": "local",
    "platform": "macOS per-user LaunchAgent / Rust process"
  },
  "summary": "The long-running daemon owns the local Unix-domain JSON-RPC endpoint, session lifecycle, shell PTYs and optional remote relay; it persists session metadata while runtime terminal output history is memory-only.",
  "anchors": [
    "crates/axo-server/src/lib.rs",
    "crates/axo-server/src/session.rs",
    "crates/axo-server/src/panes.rs",
    "crates/axo-server/src/workspace_access.rs",
    "crates/axo-relay/src/credential.rs",
    "crates/axo-relay/src/host.rs",
    "crates/axo-relay/src/lib.rs",
    "crates/axo-relay/src/pairing.rs",
    "crates/axo-relay/src/relay.rs",
    "crates/axo-server/build.rs",
    "crates/axo-pty/src/lib.rs",
    "crates/axo-pty/src/command.rs",
    "crates/axo-pty/src/output.rs",
    "crates/axo-pty/src/process.rs",
    "crates/axod/src/main.rs",
    "packages/axo-api-worker/tests/axod-relay.test.ts",
    "packages/axo-api-worker/tests/axod.test.ts",
    "packages/axo-api-worker/tests/local.test.ts",
    "crates/axod/tests/rpc.rs"
  ],
  "sources": {
    "crates/axo-pty/src/command.rs": "3b42a3b3ba3c392771f2ccbd44dc9d653b60d382",
    "crates/axo-pty/src/lib.rs": "715b13dd69fe346c1c2e3cfe19c1b99c1220cfa0",
    "crates/axo-pty/src/output.rs": "df5dbbc4c900dd7ad7537f961dc1fafb23bc135a",
    "crates/axo-pty/src/process.rs": "a6f215ee3de5f37fd19032c812292a6e0e7bd5c8",
    "crates/axo-relay/src/credential.rs": "ccd5f837fa647f1d7d5daf1c065d8f6a8d13f7eb",
    "crates/axo-relay/src/host.rs": "c61cf98ba1ecf2d1d07767eded1476d8039cb75f",
    "crates/axo-relay/src/lib.rs": "bf4a49eb174e584a6217d69fe935716dd55e2851",
    "crates/axo-relay/src/pairing.rs": "2eb18468d2c2efdc7f6c64726b4cb3a15a1e3e87",
    "crates/axo-relay/src/relay.rs": "c6c7f3ef7b59e6889c02e1d2f7c4d4a9f220f6d9",
    "crates/axo-server/build.rs": "ab2e7a78d3bf4f1c17f6af48fbc20bb9e7e987a0",
    "crates/axo-server/src/lib.rs": "e6c0c4e096ef34734ba01be54897f35775762b89",
    "crates/axo-server/src/panes.rs": "f8ad8de808b8fc409a5b96b1a08ee635e1b30a49",
    "crates/axo-server/src/session.rs": "3179b8ca94029ce7178960416ab8898d721a5cee",
    "crates/axo-server/src/workspace_access.rs": "58fd10a8dec7bdf9aae3c8b38a7095fe091d9037",
    "crates/axod/src/main.rs": "30259d1461e07a8a613ff96d3d21c768109ece6d",
    "crates/axod/tests/rpc.rs": "b0b6f698cfc7e7e077f40066e49bc8f5bd154545",
    "packages/axo-api-worker/tests/axod-relay.test.ts": "9c41d7c58b242b9adde0f94a5392475a1dff7349",
    "packages/axo-api-worker/tests/axod.test.ts": "5b1dbe8b44c49b4c622cce46744e0b9382e4ac5c",
    "packages/axo-api-worker/tests/local.test.ts": "f86fc650bdd04767aee5f5faab2442d7ec48fe27"
  }
}
