{
  "kind": "program",
  "provenance": "first-party",
  "runsOn": {
    "location": "local",
    "platform": "macOS command-line process"
  },
  "summary": "The axod executable starts the daemon or attaches a terminal's standard input and output to a daemon-owned PTY.",
  "anchors": [
    "crates/axod/src/main.rs"
  ],
  "sources": {
    "crates/axod/src/main.rs": "30259d1461e07a8a613ff96d3d21c768109ece6d"
  }
}
